ID;Объект;Линейный размер;Материал;Расположение;Количество;Доп.параметры;Уверенность
1;перегородки;толщина 150 мм;материал не указан на чертеже;согласно условным обозначениям, на плане 1-го этажа;не указано;не указано;высокая
2;перегородки в санузлах;толщина 100 мм (или 85 мм с учетом штукатурки);кирпич;в помещениях санузлов на плане 1-го этажа;не указано;указано сечение 40x200 мм;высокая
3;перегородки из гипсокартона;толщина 100 мм;гипсокартон;согласно условным обозначениям, на плане 1-го этажа;не указано;не указано;высокая
4;несущие перегородки;толщина 80 мм;материал не указан на чертеже;согласно условным обозначениям, на плане 1-го этажа;не указано;не указано;высокая
5;керамические перегородки;толщина 120 мм;керамика;согласно условным обозначениям, на плане 1-го этажа;не указано;не указано;высокая
